{"$schema":"https://json-schema.org/draft/2020-12/schema","$id":"https://github.com/newcovid/nonebot-plugin-yijing/data/schemas/chapter_text.schema.json","title":"chapter_text","description":"Chapter or section records for Xici, Shuogua, Xugua, and Zagua.","type":"array","items":{"type":"object","additionalProperties":true,"required":["chapter","text","source_id","status"],"properties":{"chapter":{"type":"integer","minimum":1},"title":{"type":"string"},"text":{"type":"string"},"source_id":{"type":"string","minLength":1},"status":{"type":"string","enum":["placeholder","draft","seeded","checked","verified"]},"section":{"type":"string"},"edition":{"type":"string"},"source_locator":{"type":"string"},"collation_notes":{"type":"string"}}}}
