[
  {
    "chapter": 1,
    "title": "一篇",
    "text": "乾刚坤柔，比乐师忧。\n临、观之义，或与或求。\n屯见而不失其居，蒙杂而著。\n震起也，艮止也。\n损、益，盛衰之始也。\n大畜时也，无妄灾也。\n萃聚，而升不来也。\n谦轻，而豫怠也。\n噬嗑食也，贲无色也。\n兑见，而巽伏也。\n随无故也，蛊则饬也。\n剥烂也，复反也。\n晋昼也，明夷诛也。\n井通，而困相遇也。\n咸速也，恒久也。\n涣离也，节止也。\n解缓也，蹇难也。\n睽外也，家人内也。\n否、泰，反其类也。\n大壮则止，遁则退也。\n大有众也，同人亲也。\n革去故也，鼎取新也。\n小过过也，中孚信也。\n丰多故也，亲寡旅也。\n离上，而坎下也。\n小畜寡也，履不处也。\n需不进也，讼不亲也。\n大过颠也，姤遇也，柔遇刚也。\n渐女归待男行也，颐养正也，既济定也。\n归妹女之终也，未济男之穷也。\n夬决也，刚决柔也。君子道长，小人道消也。\n校诂版\n乾刚坤柔。比乐师忧。临观之义。或与或求。屯见而不失其居。蒙稚而著。震起也。艮止也。损益。盛衰之始也。大畜。时也。无妄。灾也。萃聚而升不来也。谦轻而豫怠也。噬嗑。食也。贲。无色也。兑见而巽伏也。随。无事也。蛊则饬也。剥。烂也。复。反也。晋。昼也。明夷。诛也。井通而困相遇也。咸。速也。恒。久也。涣。离也。节。止也。解。缓也。蹇。难也。睽。外也。家人。内也。否泰。反其类也。大壮则止。遁则退也。大有。众也。同人。亲也。革去故也。鼎取新也。小过过也。中孚信也。丰多故也。旅寡亲也。离上而坎下也。小畜。寡也。履。不处也。需。不进也。讼。不亲也。大过。颠也。姤。遇也。柔遇刚也。渐。女归待男行也。颐。养正也。既济。定也。归妹。女之终也。未济。男之穷也。夬。决也。刚决柔也。君子道长。小人道忧也。",
    "source_id": "wikisource_zhouyi",
    "status": "checked",
    "edition": "Wikisource zh-hans HTML page scrape",
    "source_locator": "周易/雜卦#一篇"
  }
]
