[
  {
    "chapter": 1,
    "title": "上篇",
    "text": "有天地，然后万物生焉。\n盈天地之间者，唯万物，故受之以屯；屯者盈也，屯者物之始生也。\n物生必蒙，故受之以蒙；蒙者蒙也，物之穉也。\n物穉不可不养也，故受之以需；需者饮食之道也。\n饮食必有讼，故受之以讼。\n讼必有众起，故受之以师；师者众也。\n众必有所比，故受之以比；比者比也。\n比必有所畜也，故受之以小畜。\n物畜然后有礼，故受之以履。\n履而泰，然后安，故受之以泰；泰者通也。\n物不可以终通，故受之以否。\n物不可以终否，故受之以同人。\n与人同者，物必归焉，故受之以大有。\n有大者不可以盈，故受之以谦。\n有大而能谦，必豫，故受之以豫。\n豫必有随，故受之以随。\n以喜随人者，必有事，故受之以蛊；蛊者事也。\n有事而后可大，故受之以临；临者大也。\n物大然后可观，故受之以观。\n可观而后有所合，故受之以噬嗑；嗑者合也。\n物不可以苟合而已，故受之以贲；贲者饰也。\n致饰然后亨，则尽矣，故受之以剥；剥者剥也。\n物不可以终尽，剥穷上反下，故受之以复。\n复则不妄矣，故受之以无妄。\n有无妄然后可畜，故受之以大畜。\n物畜然后可养，故受之以颐；颐者养也。\n不养则不可动，故受之以大过。\n物不可以终过，故受之以坎；坎者陷也。\n陷必有所丽，故受之以离；离者丽也。",
    "source_id": "wikisource_zhouyi",
    "status": "checked",
    "edition": "Wikisource zh-hans HTML page scrape",
    "source_locator": "周易/序卦#上篇"
  },
  {
    "chapter": 2,
    "title": "下篇",
    "text": "有天地然后有万物，有万物然后有男女，有男女然后有夫妇，有夫妇然后有父子，有父子然后有君臣，有君臣然后有上下，有上下然后礼仪有所错。\n夫妇之道，不可以不久也，故受之以恒；恒者久也。\n物不可以久居其所，故受之以遁；遁者退也。\n物不可终遁，故受之以大壮。\n物不可以终壮，故受之以晋；晋者进也。\n进必有所伤，故受之以明夷；夷者伤也。\n伤于外者，必反其家，故受之以家人。\n家道穷必乖，故受之以睽；睽者乖也。\n乖必有难，故受之以蹇；蹇者难也。\n物不可终难，故受之以解；解者缓也。\n缓必有所失，故受之以损。\n损而不已，必益，故受之以益。\n益而不已，必决，故受之以夬； 夬者决也。\n决必有所遇，故受之以姤；姤者遇也。\n物相遇而后聚，故受之以萃；萃者聚也。\n聚而上者，谓之升，故受之以升。\n升而不已，必困，故受之以困。\n困乎上者，必反下，故受之以井。\n井道不可不革，故受之以革。\n革物者莫若鼎，故受之以鼎。\n主器者莫若长子，故受之以震；震者动也。\n物不可以终动，止之，故受之以艮；艮者止也。\n物不可以终止，故受之以渐；渐者进也。\n进必有所归，故受之以归妹。\n得其所归者必大，故受之以丰；丰者大也。\n穷大者必失其居，故受之以旅。\n旅而无所容，故受之以巽；巽者入也。\n入而后说之，故受之以兑；兑者说也。\n说而后散之，故受之以涣；涣者离也。\n物不可以终离，故受之以节。\n节而信之，故受之以中孚。\n有其信者，必行之，故受之以小过。\n有过物者，必济，故受之既济。\n物不可穷也，故受之以未济；终焉。",
    "source_id": "wikisource_zhouyi",
    "status": "checked",
    "edition": "Wikisource zh-hans HTML page scrape",
    "source_locator": "周易/序卦#下篇"
  }
]
